{
  "id": "b03921dc-8e23-5e8a-bf0e-55a8e3904673",
  "taxYear": "2018-19",
  "requestedBy": "customer",
  "calculationReason": "customerRequest",
  "calculationTimestamp": "2019-02-15T08:22:15.094Z",
  "calculationType": "inYear",
  "intentToCrystallise": false,
  "crystallised": false,
  "totalIncomeTaxAndNicsDue": 2000.98,
  "links": [
    {
      "href": "/individuals/calculations/RW399019B/self-assessment/f2fb30e5-4ab6-4a29-b3c1-c7264259ff1c",
      "rel": "self",
      "method": "GET"
    },
    {
      "href": "/individuals/calculations/RW399019B/self-assessment/f2fb30e5-4ab6-4a29-b3c1-c7264259ff1c/income-tax-nics-calculated",
      "rel": "income-tax-and-nics-calculated",
      "method": "GET"
    },
    {
      "href": "/individuals/calculations/RW399019B/self-assessment/f2fb30e5-4ab6-4a29-b3c1-c7264259ff1c/taxable-income",
      "rel": "taxable-income",
      "method": "GET"
    },
    {
      "href": "/individuals/calculations/RW399019B/self-assessment/f2fb30e5-4ab6-4a29-b3c1-c7264259ff1c/allowances-deductions-reliefs",
      "rel": "allowances-deductions-reliefs",
      "method": "GET"
    },
    {
      "href": "/individuals/calculations/RW399019B/self-assessment/f2fb30e5-4ab6-4a29-b3c1-c7264259ff1c/end-of-year-estimate",
      "rel": "end-of-year-estimate",
      "method": "GET"
    },
    {
      "href": "/individuals/calculations/RW399019B/self-assessment/f2fb30e5-4ab6-4a29-b3c1-c7264259ff1c/messages",
      "rel": "messages",
      "method": "GET"
    }
  ]
}